id;id_article;pays;fips;continent;sous_continent;localisation_fine;autres_pays_concernes;latitude;longitude;code_origine_alea;origine_alea;code_alea;alea;code_peril;peril;code_sous_peril;sous_peril;annee;mois;date_debut;date_fin;nbre_evacues;nbre_pers_affectees;nbre_blesses;nbre_victimes;nbre_sans_abris;indice_csq_humaines;indice_csq_materielles;indice_evt;cout_estime;titre_article;article
1717;4529;Algérie;AG;Afrique;Maghreb;;Maroc;27.67;-8.15;Met;Météorologique;15;"15 Intempéries";151;"151 Intempéries pluvieuses";;;2006;Fév.;2006-02-12;2006-02-12;0;60000;0;1;0;2;2;2;1;"Intempéries pluvieuses en Algérie et au Maroc";"""Des pluies diluviennes, accompagnées d'orages et de vents violents, se sont abattues dernièrement sur les camps de Tindouf en Algérie, détruisant plusieurs tentes et causant d'importants dégâts aux habitations en pisé et aux biens des populations. Ce camps abrite environ 50000 réfugiés. On déplore la mort d'une personne.  Ces fortes pluies à caractère orageux ont également touché Marrackech où durant une heure 20 mm de pluie sont tombés, transformant de nombreuses artère de la ville en véritables Oued. Les autorités rapportent que des dizaines de caves ont été inondées et que plusieurs quartiers ont été privés d'électricité.  On ne déplore ni victime ni blessé  Source : L'Economiste"""
5765;4485;Algérie;AG;Afrique;Maghreb;Oran;;26.50;8.48;Hydro;Hydrologique;01;"01 Inondations et coulées de boue";011;"011 Crue";0112;"0112 Débordement torrentiel";2006;Janv.;2006-01-31;2006-02-02;400;0;0;0;0;1;2;2;0;"De fortes pluies provoquent des inondations en Algérie";"""Les pluies exceptionnelles qui se sont abattues sur la wilaya d’Illizi en Algérie ont provoqué le débordement de l’oued Illizi qui a entrâiné des inondations au niveau de la ville. Le bilan matériel est assez lourd : 10 habitations se sont effondrées et 166 familles sinistrées relogées dans des centres.<br><br>Plusieurs axes routiers ont été coupés. Les inondations ont touché les habitations, plusieurs infrastructures et des locaux commerciaux. Une famille a été secourue à la cité El Djedab alors qu'elle était cernée par les eaux. Quatre autres personnes ont été sauvées par les agents de la Protection civile. Ils ont procédé ensuite à l’épuisement des eaux pluviales dans plusieurs quartiers de la ville. <br><br>La zone la plus touchée est le quartier Aïn Kourse et certaines localités alentours telles que El Karia, Tin Emri, Sidi Bouslah, Tecbelt, ont fortement sinistrée. <br><br>A Oran de forte pluies qui ont entraîné des inondations dans toute l'agglomération. Routes bloquées, ronds-points inondés, maisons inondées ces inondations n'ont néanmoins pas fait de victime ni de blessé. Une cinquantaine de maisons ont été inondées à Ras Aïn. Plusieurs quartiers ont subi des coupures d'électricité.<br><br>Les services de la Protection civile ont dû intervenir une quarantaine de fois dans des zones classées à risque, tels les quartiers de Derb (où le mur d'une maison s'est écroulé), et de Sidi El Houari et El Hamri, où bruits et fissures ont réveillé la peur des habitants dont beaucoup ont fui leurs demeures."""
5738;4359;Algérie;AG;Afrique;Maghreb;;;36.90;7.75;Hydro;Hydrologique;01;"01 Inondations et coulées de boue";012;"012 Ruissellement";0122;"0122 Ruissellement urbain";2005;Déc.;2005-12-14;2005-12-14;0;0;0;0;0;0;2;2;0;"L'Est de l'Algérie en proie aux inondations";"""L'Est de l'Algérie en proie aux inondations - 14 décembre 2005<br><br>Les fortes pluies qui se sont abattues depuis mardi dans les régions Est de l'Algérie, ont occasionné des dégâts importants et des inondations de certains quartiers, notamment à Annaba, faisant des dizaines de sinistrés.<br><br>Toutes les parties basses de Annaba ont été inondées, suite aux pluies des dernières 48 heures et le niveau des eaux est passé à plus d'un mètre dans certaines zones, contraignant des dizaines de familles à quitter leurs foyers. Les magasins et les habitations ont subi de dégâts matériels importants qui restent a évaluer, précise-t-on de mêmes sources.<br><br>Dans la région de Souk Ahras (Est) , les importantes chutes de pluies, accompagnées de rafales de vent violent ont occasionné des dégâts matériels aux habitations précaires des quartiers périphériques de la ville et d'autres communes plus éloignées. A ces inondations se sont ajoutées des coupures prolongées du courant électrique qui ont perturbé l'activité économique et la vie dans les foyers. Par ailleurs, nombre d'établissements scolaires inondés à Annaba ont fermé leurs portes.<br><br>La wilaya de Annaba était totalement paralysée rapporte le journal &quot;El Watan&quot;, indiquant que, durant les dernières 48 heures, faute d'alimentation électrique ou à cause pour inondation, plusieurs entreprises publiques et privées ainsi que des locaux de commerce sont restés fermés.<br><br>Dans la région de Skikda (530 km à l'est d'Alger), des inondations ont été enregistrées dans plusieurs quartiers amenant les services de la protection civile à intervenir pour pomper l'eau dans certaines installations sensibles envahies par les eaux."""
5585;3632;Algérie;AG;Afrique;Maghreb;;;36.46;6.74;Clim;Climatique;06;"06 Incendies de forêt";;;;;2005;Sept.;2005-09-03;2005-09-04;0;0;0;0;0;0;2;2;0;"Près de 150 ha brûlés en Algérie";"""Près de 150 ha brûlés en Algérie - 03 et 04 septembre 2004<br><br>Un incendie a parcouru près de 150 ha de forêt en Algérie. Le bilan fourni par les services compétents indique que 5 ha de liège, 135 ha de diss et 5 ha de pins ont été entièrement détruits par les flammes. <br><br>Un pyromane serait directement à l’origine de ce sinistre, selon le directeur de la Protection civile, qui a précisé, en outre, que ce dernier a allumé quatre foyers en différents endroits de cette forêt qui se trouve sur les hauteurs de la ville et en amont du magnifique parc forestier de Djebel Ouahch. <br><br>Par mesure de précaution, les éléments de la Protection civile sont restés sur place une bonne partie de la nuit de dimanche, de crainte que d’éventuelles braises ne soient attisées par les rafales de vent qui soufflaient sporadiquement."""
2480;3395;Algérie;AG;Afrique;Maghreb;Naama;;33.26;-0.31;Hydro;Hydrologique;01;"01 Inondations et coulées de boue";011;"011 Crue";0112;"0112 Débordement torrentiel";2005;Août;2005-08-24;2005-08-24;0;0;1;1;0;2;2;2;0;"Crue torrentielle en Algérie : 1 mort";"Crue torrentielle en Algérie : 1 mort - 24 août 2005<br><br>La ville algérienne de Naama et sa région (550 km au sud-ouest) ont été touchées par des fortes pluies qui ont occasionné des crues torrentielles. Un homme a &nbsp;été blessé après avoir été emporté par un cours d'eau en crue mais a pu être sauvée par les secouristes. En revanche les autorité local rapportent qu'une femme s'est noyée lors de l'événement."
5492;3625;Algérie;AG;Afrique;Maghreb;;;36.72;4.05;Clim;Climatique;06;"06 Incendies de forêt";;;;;2005;Août;2005-08-12;2005-08-13;0;0;0;0;0;0;2;2;0;"Multiplication des incendies en Algérie";"""Multiplication des incendies en Algérie - 12 et 13 août 2005<br><br>Pas moins de 16 foyers d’incendies ont été enregistrés, avant-hier, par les services de la Protection civile à travers la wilaya de Tizi-Ouzou qui ont ravagé 180 ha de forêt, d’arbres fruitiers, de broussailles et d’oliviers. <br><br>Le plus important incendie a été enregistré dans la commune de Ouaguenoune où les feux ont ravagé 90 ha de chênes-liège. Les éléments de la Protection se sont confrontés à d’énormes difficultés pour maîtriser ces incendies. Le village d’Ibahlal a connu la destruction de plus de trois cent oliviers durant les dernières 24 heures. A Aghribes, les feux de forêts ont ravagé 8 ha de maquis et ont détruit 50 ruches d’abeilles. L’incendie qui pris le départ au village Aït Kharcha dans la commune de Tadmaït a ravagé plus de 150 oliviers et a détruit deux poulaillers.<br><br>La Protection civile indique, enfin que durant l’après-midi d’hier, ses éléments étaient toujours en lutte contre l’incendie qui a pris le départ avant-hier à Ouguenoun située à quelques 20 km à l’est de la wilaya."""
2919;3600;Algérie;AG;Afrique;Maghreb;;;36.76;8.26;Clim;Climatique;06;"06 Incendies de forêt";;;;;2005;Juill.;2005-07-17;2005-07-18;0;0;0;0;0;0;2;2;0;"28 incendies en Algérie";"""28 incendies en Algérie - 17 et 18 juillet 2005<br><br>Vingt-huit incendies de forêts ont touché dimanche 14 wilayas (départements) en Algérie, a indiqué à la radio publique un responsable de la Direction des forêts algériennes. Cinq départements sont partuculièrement touchés avec trois incendies dans chacun d'eux :Béjaïa, en Kabylie (est d'Alger), El-Tarf (est), Médéa (sud), Aïn Defla et Tissemsilt (ouest et sud-ouest). <br><br>Depuis le 1er juin, ses services avaient enregistré 340 incendies qui avaient détruit 1.600 hectares de forêts.<br><br>La température caniculaire depuis quelques jours est une des causes de ces incendies. Il a fait 39 degrés samedi à Alger. La météo ne prévoit pas de baisse de la température avant mardi."""
1974;3139;Algérie;AG;Afrique;Maghreb;;;34.11;2.09;Met;Météorologique;10;"10 Grêle";;;;;2005;Juill.;2005-07-10;2005-07-10;0;0;0;0;100;1;2;2;0;"Forte averse de grêle dans le Djebel Algérien";"""Forte averse de grêle dans le Djebel Algérien - 10 juillet 2005<br><br>De fortes averses de grêle ont fait 20 familles sans abri dans la région d'Aflou. Les sinistrés ont été regroupées dans un camp de toile sécurisé, électrifié et alimenté en eau potable. Cet épisode a également causé d'important dégâts aux cultures pratiquées dans ce secteur puisque plusieurs dizaines d’hectares de pommes de terre ont été &nbsp;inondés en plus des pertes arboricoles.<br><br>Cependant, pour exceptionnels qu’ils soient, les orages d’été et les chutes de grêle dans la région du Djebel Amour restent un fait tout à fait ordinaire lié à l’altitude (1700 m) et n’expliquent pas les inondations à répétition. Celles-ci sont dues au déficit en matière d’aménagement au niveau des quartiers riverains de l’oued et à la transformation de l’oued en caniveau."""
1943;3619;Algérie;AG;Afrique;Maghreb;;;36.72;4.01;Clim;Climatique;06;"06 Incendies de forêt";;;;;2005;Juin;2005-06-28;2005-06-28;0;0;0;0;0;0;2;2;0;"Incendies de forêt en Algérie";"""Incendies de forêt en Algérie - 28 juin 2005<br><br>Plusieurs feux de forêts ont été déclenchés hier dans la wilaya de Tizi-Ouzou. Le plus important foyer d’incendie a été signalé au niveau de la forêt de Harouza non loin de l’hôpital Belloua au centre-ville de Tizi-Ouzou. Les éléments de la Protection civile ont enregistré en effet, d’importants dégâts. Plusieurs centaines d’hectares ont été ravagés par l’incendie déclarée au niveau de la forêt de Harouza. Vu l’ampleur de l’incendie les éléments de la Protection civile ont transféré plus de 150 malades hospitalisés à l’hôpital de Belloua vers le CHU de Tizi-Ouzou pour parer au danger et leur éviter l’étouffement par la fumée épaisse dégagée par le feu. <br><br>Par ailleurs, les éléments de la Protection civile ont enregistré plusieurs feux de forêts notamment dans les localités de Draâ El-Mizan, Ouadhia, et Sidi Ali Bounab. Néanmoins, ces foyers d’incendie ne sont pas d’une importance énorme et n’ont causé que quelques dégâts matériels."""
5440;3396;Algérie;AG;Afrique;Maghreb;;;24.55;9.46;Hydro;Hydrologique;01;"01 Inondations et coulées de boue";011;"011 Crue";0112;"0112 Débordement torrentiel";2005;Juin;2005-06-17;2005-06-19;1750;0;0;1;0;0;2;2;7;" Crues d'Oued près de Djanet (Algérie)";"""La région de Djanet a essuyé de violentes pluies qui ont provoqué de soudaine crues d'oueds. Le quartier nord de la ville a été le plus touché, à partir de Ksar El-Mihan jusquaux habitations des quartiers dits TBal Mawallen et Djazira. Le niveau de l'eau y a atteint les 1,50 m et par endroit des coulées boueuses ont submergé les jardins des maisonnettes érigées presque au même niveau que le fleuve sec. Une personne a trouvé la mort.La pluie sest mise à tomber à torrents à partir de vendredi soir (17 juin, ndlr) et s'est intensifiée le samedi et le dimanche. Dans sa furie, loued a emporté plusieurs voitures. La puissance des inondations était telle que des poteaux entiers ont été arrachés, plongeant Djanet dans l'obscurité total durant plusieurs jours.Djanet na pas vécu ce genre dinondations depuis 1964. En 1963, il y a eu de fortes pluies, mais lannée 1964 fut terrible. Depuis, loued ne sest pas mis en furie jusquà cette année selon certains habitants.Si les maisons, en particulier celles précaires, ont été sévèrement ébranlées par les dernières intempéries qui ont endeuillé Djanet, la palmeraie et ses fabuleux jardins, ont été touchés de plein fouet par le soulèvement de loued Djanet. Dans loued, les dégâts sont nettement visibles : poteaux électriques inclinés, plants de vigne, de tomates, doignons, de haricots verts et autres cultures maraîchères déracinés, arbres fruitiers couchés, palmiers dattiers secoués et dont les branches ont été cisaillées par la violence des vents.Source : AFP"""
5381;3391;Algérie;AG;Afrique;Maghreb;"wilaya de Djelfa";;34.65;3.25;Hydro;Hydrologique;01;"01 Inondations et coulées de boue";011;"011 Crue";0112;"0112 Débordement torrentiel";2005;Avril;2005-04-28;2005-04-28;0;0;0;3;0;2;1;2;0;"3 morts dans des crues d'oueds en Algérie";"""Trois personnes sont mortes noyées &nbsp;à Had S'hari, dans la wilaya de Djelfa (250km au sud d'Alger), suite aux pluies diluviennes qui ont provoqué la crue d'un oued, rapporte &nbsp;la radio algérienne. Celle-ci précise que les trois victimes, emportées par les eaux suite au brusque orage qui s'est abattu sur cette région pastorale du sud du pays, sont respectivement âgées de 7, 12 et 50 ans."""
3091;3373;Algérie;AG;Afrique;Maghreb;;;22.80;5.52;Hydro;Hydrologique;01;"01 Inondations et coulées de boue";011;"011 Crue";0112;"0112 Débordement torrentiel";2005;Mars;2005-03-06;2005-03-07;0;0;0;6;0;3;2;3;0;"Le centre de l'Algérie frappé par des inondations  : 6 morts";"""Le centre de l'Algérie frappé par des inondations &nbsp;: 6 morts - 06 et 07 mars 2005<br><br>Six personnes sont mortes et deux sont portées disparues dans les inondations qui ont frappé la wilaya (département) de Tamanrasset (2.000km au sud d'Alger), selon la cellule de crise de la wilaya.Les victimes sont mortes dans la crue d'un oued provoquée par les pluies diluviennes qui se sont abattues sur la région. Six corps ont été retrouvés et deux autres sont toujours recherchés.<br><br>D'autre part, plus de 185 habitations ont été également endommagées, à des taux allant de 40 à 80%, dans les régions Abalessa, In M'guel, Tazrouk, Hirafouk et Idlès, ajoute le même bilan.<br><br>Les secours et les aides en tentes, couvertures, produits alimentaires et médicaments se poursuivent en faveur des populations sinistrées, alors que les équipes médicales assurent la couverture sanitaire des populations et veillent au contrôle des points d'approvisionnement en eau potable pour éviter tout risque de contamination.<br><br>Les services de travaux publics se chargent, de leur côté, du désenclavement des zones sinistrées, notamment à Tazrouk et Idles, pour permettre l'acheminement des approvisionnements.<br><br>Quelque 70 voyageurs, surpris par la crue des oueds, ont été bloqués et ont été secourus par des hélicoptères de l'armée.Ces fortes pluies ont également provoqué des &quot;dégâts considérables&quot; aux routes, aux cultures, et aux réseaux d'électricité, d'eau et de téléphone.<br><br>L'Algérie connaît depuis fin janvier des intempéries à répétition accompagnée d'une vague de froid exceptionnelle. Des chutes de neige record et des pluies torrentielles ont été enregistrées dans le nord-est du pays, isolant de nombreuses localités et contraignant l'armée à intervenir pour dégager les routes, notamment en Kabylie (est).<br><br>Au moins 30 personnes étaient mortes à la suite de ces intempéries, notamment dans des accidents de la route."""
2872;3939;Algérie;AG;Afrique;Maghreb;Alger;;36.76;3.05;Geo;Géologique;02;"02 Mouvements de terrain";021;"021 Glissement de terrain";;;2005;Mars;2005-03-01;2005-03-01;0;0;0;2;0;2;2;2;0;"Glissement de terrain dans un bidonville d'Alger : 2 morts";"""Glissement de terrain dans un bidonville d'Alger : 2 morts - 01 mars 2005<br><br>Deux personnes sont mortes et 14 autres ont été blessées, mardi, à Bab El Oued, en plein centre d`Alger, suite à l`effondrement de leurs maisons provoqué par un glissement de terrain, ont annoncé les services de la protection civile.<br><br>C`est un bidonville, constitué de 413 baraques, construit illégalement sur un site ravagé par les inondations meurtrières de Bab El Oued en novembre 2001, qui a été touché par le glissement de terrain.<br><br>D`autres quartiers d`Alger ont, également, subi quelques dégâts matériels sans faire de victimes mardi matin suite aux intempéries, a précisé le maire de Belouizdad. Il souligne que les travaux et réhabilitations effectués après le séisme de mai 2003 ont permis de renforcer de nombreux immeubles, leur évitant ainsi le pire aujourd`hui.<br><br>Ces dégâts sont provoqués par des pluies ininterrompues qui tombent sur le centre du pays depuis plusieurs jours."""
756;3998;Algérie;AG;Afrique;Maghreb;;;36.71;4.28;Met;Météorologique;15;"15 Intempéries";153;"153 Intempéries neigeuses";;;2005;Janv.;2005-01-26;2005-01-29;0;0;47;13;0;3;2;3;0;"Intempéries neigeuses et inondations  en Algérie : 13 morts";"""Intempéries neigeuses et inondations &nbsp;en Algérie : 13 morts - 26 au 29 janvier 2005<br><br>Treize personnes ont trouvé la mort et 47 autres sont blessées après les chutes de neige qui ont touché le nord algérien, rapportent samedi les médias qui ont consacré une large couverture à ce phénomène sans précédent.La plupart des victimes sont recensées en Kabylie (100km à l'est d'Alger) où la neige, atteignant dans certaines localités 1,5m de hauteur, a bloqué les routes, causant aussi des chutes de lignes à haute tension et des effondrements de vieilles maisons. A Bouira, sept personnes sont décédées: deux suite à la chute d'un arbre et cinq sont retrouvées mortes à leur domicile à cause du froid.<br><br>Dans la commune d'Irdjen, près de Tizi-Ouzou, trois personnes sont mortes par électrocution, selon le quotidien &quot;Liberté&quot; qui indique que l'accident s'est produit au moment où des jeunes du village prêtaient main forte aux agents de la société d'électricité SONELGAZ, dépêchés pour rétablir une ligne haute tension qui a cédé sous le poids de la neige.<br><br>Par ailleurs, deux hommes ont été retrouvés morts par les agents de la Protection civile dans la sous-préfecture de Draâ el-Mizan, après que la toiture de leur poulailler s'est effondrée.<br><br>A Draâ el-Kaïd, dans le département de Bejaïa (160km à l'est d'Alger), un jeune homme a fait une chute mortelle en s'essayant à la glisse sur une planche.<br><br>L'agence officielle APS fait état également de nombreux accidents de la route, notamment dans les villes où les conducteurs de véhicules ne sont pas habitués à rouler sur la neige.<br><br>En plus d'une vague de froid cinquantenale, l'Algérie est également confrontée à des pluie torrentielles responsables d'inondations qui ont fait 5 victimes et 40 blessés. Ces crues ont endommagé de nombreuses habitations et emporté des véhicules.<br><br>En quarante-huit heures seulement, 50 mm de pluie ont été enregistrées à Alger, 73 mm à Jijel, 72 mm à Béjaïa, 33 mm à Tizi Ouzou, 53 mm à Médéa et 29 mm à Annaba"""
3094;2766;Algérie;AG;Afrique;Maghreb;;;36.76;3.46;Geo;Géologique;03;"03 Séismes";031;"031 Séismes tectoniques";;;2004;Déc.;2004-12-05;2004-12-05;0;0;46;0;0;2;1;2;0;"Nouvelle secousse tellurique en Algérie : 46 blessés";"""Nouvelle secousse tellurique en Algérie : 46 blessés - 05 décembre 2004<br><br>Au moins 46 personnes saisies de panique à la suite d'une secousse tellurique ont été blessées dimanche matin à Boumerdès (50 km à l'est d'Alger), a indiqué la radio d'Etat. &nbsp;&nbsp;La radio a précisé qu'hormis ces blessés &quot;légers&quot;, il n'a été enregistré ni victimes ni dégâts. &nbsp;<br><br>&nbsp;Cette secousse, réplique du violent tremblement de terre qui avait secoué cette région le 21 mai 2003, est d'une magnitude 4,7 degrés sur l'échelle ouverte de Richter. Elle a été enregistrée à 09H31 (08H31 GMT), avait annoncé le Centre algérien de recherche en astronomie, astrophysique et géophysique (CRAAG). &nbsp;&nbsp;Son épicentre a été localisé à deux kilomètres au nord-ouest de Zemmouri, à une quinzaine de kilomètres à l'est de Boumerdès, a précisé le CRAAG. &nbsp;Elle a été ressentie par des habitants d'Alger. &nbsp;&nbsp;<br><br>&nbsp;Mercredi soir, un séisme de 5,7 sur l'échelle de Richter avait secoué la région de Boumerdès, faisant une centaine de blessés légers et provoquant un mouvement de panique des habitants encore traumatisés par le tremblement de terre meurtrier de mai 2003. &nbsp;Ce tremblement de terre, dont les stigmates sont encore visibles, avait pratiquement rasé la ville de Zemmouri, détruit en partie Boumerdès, et fait près de 2.300 morts et plus de 11.000 blessés, selon un bilan officiel. &nbsp;<br><br>&nbsp;Le nord de l'Algérie est une zone à forte sismicité. Il est situé sur la jonction des plaques eurasiatique et africaine, selon la théorie scientifique de la tectonique des plaques. &nbsp;&nbsp;En 1365, Alger avait été complètement détruite par un violente tremblement de terre qui avait également entrainé un raz de marée inondant la moitié de la ville. &nbsp;&nbsp;Depuis, au moins une vingtaine de forts séismes, ont été enregistrés en Algérie. Quatre ont fait plus de 100 morts et deux plus de 2.000 morts, selon le site internet du CRAAG."""
5345;2786;Algérie;AG;Afrique;Maghreb;;;36.81;3.46;Geo;Géologique;03;"03 Séismes";031;"031 Séismes tectoniques";;;2004;Déc.;2004-12-01;2004-12-01;0;0;100;0;0;2;1;2;0;"Séisme de mg 5.7 dans la région de Bourmerdès (Algérie) : une centaine de blessés";"""Séisme de mg 5.7 dans la région de Bourmerdès (Algérie) : une centaine de blessés - 01 décembre 2004<br><br>Le séisme d'une magnitude de 5,7 sur l'échelle de Richter qui a frappé mercredi soir la région de Boumerdès (50 km à l'est d'Alger), a fait une centaine de blessés légers, a indiqué jeudi la télévision algérienne. De nombreuses personnes, prises de panique, se sont blessées en sautant des fenêtres de leurs appartements ou en tombant dans des escaliers, a expliqué une responsable de la protection civile. La panique a été accentuée par la coupure de courant qui a touché toute la région de Boumerdès ainsi que des villes du département d'Alger voisin, a-t-il précisé. &nbsp;<br><br>&nbsp;Le Centre algérien de recherche en astronomie, astrophysique et géophysique (CRAAG) avait indiqué mercredi que l'épicentre de cette secousse, ressentie à 18h42 (17h42 GMT), avait été localisé à 5 km au nord de la ville de Boumerdès. &nbsp;&nbsp;Cette région et celle d'Alger ont été touchées en mai 2003 par un séisme meurtrier, d'une magnitude de 6,8 sur l'échelle de Richter qui a fait près de 2.300 morts et plus de 11.000 blessés, selon un bilan officiel. &nbsp;<br><br>&nbsp;La secousse de mercredi a été fortement ressentie par les habitants d'Alger, dont certains, inquiets, sont sortis dans la rue. &nbsp;Le directeur du CRAAG, Mohamed Hamadache, a indiqué à la radio que cette secousse était une réplique du tremblement de terre de mai 2003. Son ampleur est due &quot;à la complexité de la rupture au niveau de la faille&quot; de la couche terrestre traversant cette région, &quot;et qui a géréré une réplique de cette ampleur&quot;, a-t-il expliqué."""
