id;id_article;pays;fips;continent;sous_continent;localisation_fine;autres_pays_concernes;latitude;longitude;code_origine_alea;origine_alea;code_alea;alea;code_peril;peril;code_sous_peril;sous_peril;annee;mois;date_debut;date_fin;nbre_evacues;nbre_pers_affectees;nbre_blesses;nbre_victimes;nbre_sans_abris;indice_csq_humaines;indice_csq_materielles;indice_evt;cout_estime;titre_article;article
679;8932;Algérie;AG;Afrique;Maghreb;;;35.45;5.55;Met;Météorologique;15;"15 Intempéries";151;"151 Intempéries pluvieuses";;;2009;Janv.;2009-01-12;2009-01-13;0;0;0;7;0;3;2;3;0;"Le Nord de l'Algérie en proie aux intempéries : 7 morts";"""Le Nord de l'Algérie a essuyé un fort épisode pluvio-neigeux qui ont causé des inondations et des glissements de terrain à l'origine de la mort de 7 personne et de dégâts matériels notables.<br><br>Dans la wilaya de Tissemssilt, un homme âgé de 60 ans a été retrouvé mort, suite à la vague de froid qu’a connue la région, sur le chemin communal qui mène de Taza vers Ghanama. Six personnes issues de deux familles proches, habitant la même maison dans la commune montagneuse de Chehna, située à 36 km au sud-est du chef-lieu de la ville de Jijel, ont péri dans l’effondrement de leur maison. L’effondrement de la maison de fortune, située au lieudit El-Meraïss, s’est produit à la suite d’un glissement de terrain. Le glissement de terrain a eu lieu aux environs de 8 heures du matin, en raison de fortes précipitations.<br><br>Selon un bulletin météorologique spécial (BMS) de l’Office national de la météorologie (ONM), ces intempéries ont affecté plusieurs régions du pays, en particulier, les wilayas de l’est, Béjaïa, Sétif, Jijel, Skikda, Mila, Constantine, Annaba, El-Tarf, Guelma et Souk Ahras et du centre, Bouira, Bordj Bou-Arréridj, Tizi Ouzou, Boumerdès, Alger, Tipasa, Blida, Médéa, et Aïn Defla .<br><br>A Batna, les chutes de neige ont rendu la circulation très difficile. La RN 87 et le chemin de wilaya 54 ont été fermés à la circulation, tandis que dans la wilaya de Béjaïa, le trafic routier a été perturbé sur la RN 9 et le chemin de Wilaya N 6 a été coupé du fait du débordement de Oued Ghir, selon la Protection civile. A Annaba, des infiltrations d’eaux de pluie ont été signalées dans plus de soixante maisons notamment dans les localités d’El-Bouni, à El-Hadjar et dans six maisons dans la wilaya de Souk Ahras.<br><br>Dans la wilaya de Bouira, la route nationale reliant les communes de Chorfa et Aïn El-Hamma (Tizi Ouzou) est fermée à la circulation au niveau du Col de Tirourda (Commune d’Aghbalou) pour amoncellement de neige, tout comme la route nationale reliant Bouira et Tizi Ouzou, au lieu-dit Tizi N’Koulaine (commune de Saharidj). Dans la wilaya de Béjaïa, la route nationale reliant Béjaïa et El-Kseur est bloquée à la circulation au niveau du village Taourirt Larbaâ (commune de Oued Ghir), pour chaussée inondée qui est également la cause de la fermeture de la route nationale reliant Béjaïa et Sétif, au niveau du village Abou Daou (commune de Tala Hamza). Sur ce même itinéraire, la route est bloquée au niveau du village Tabazit (commune de Taskriout) et au niveau du village Ouled Akeryoune, commune de Souk El-Tenine, pour glissement de terrain. En outre, la route nationale, reliant les communes d’Amizour et Bouhamza au village Aït Smaïl, est coupée à la circulation pour inondation de la chaussée tout comme le chemin de wilaya reliant Amizour et El-Kseur, au domaine Morris. Le chemin de wilaya reliant la commune de Taskrout et le village Aït Smaïl est aussi fermé au lieu-dit Angouche, pour glissement de terrain, selon le point de situation. Dans la wilaya de Skikda, le carrefour formé des chemins de wilaya 57 et 08, commune d’El-Marsa, est également coupée à la circulation à cause de l’inondation de la chaussée.<br><br>Dans la wilaya de Béjaïa, des crues d’oueds ont provoqué l’inondation des champs agricoles. De nombreuses routes secondaires (chemin communaux et de wilayas) ont été également affectées par ces intempéries. La wilaya a signalé que beaucoup d’établissements scolaires ont été fermés, soit à cause de l’absence de transport, soit en raison des inondations. Pour sa part, le port a maintenu son activité de manutention mais a dû arrêter le mouvement des bateaux autant à l’entrée qu’à la sortie, les conditions météorologiques gênant leur traitement dans des conditions de sécurité optimum. Cette situation a donné lieu par ailleurs, à plusieurs coupures de courants, notamment à Béjaïa, Tichy, Akbou, Toudja et Kendira. Des avaries de câbles en sont la cause principale, exacerbées à Tichy par un incident dû à l’abattage accidentel d’un poteau électrique par un camionneur.<br><br>A l’ouest, dans la wilaya de Tissemsilt, qui a connu ces derniers jours une vague de froid insupportable, les intempéries ont causé des effondrements partiels des habitations, des fissures dans les parois de maisons et des glissements de terrains.Un site historique, le fort ou caserne colonial de Taza, datant de 1893 a aussi été touché. Une partie de ce site s’est, en effet, effondrée.<br><br>Dans la wilaya d’El-Tarf, 48 familles ont été secourues suite à des infiltrations d’eau de pluie dans leurs maisons. D’autres familles habitant des maisons précaires du côté de Benamara, dans la commune d’Echatt, et ailleurs comme Chebaita Mokhtar et Eckala ont aussi été affectées par les intempéries. Plusieurs écoles, dont « Djenane Echouk » à Dréan et « Besbes », ont été inondées au point où les élèves ont été surpris par l’eau qui est entrée dans les classes.<br><br>Enfin, selon les services de la Protection civile, les quantités d’eau tombées ont atteint les 80 mm et le plan Orsec a été déclenché. A noter qu’à cause des inondations, les habitants de plusieurs localités, excédés, ont protesté en bloquant les routes, notamment à El-Ogla, où la RN 44 a été bloquée."""
495;8841;Algérie;AG;Afrique;Maghreb;;Maroc;35.40;4.61;Met;Météorologique;15;"15 Intempéries";151;"151 Intempéries pluvieuses";;;2008;Déc.;2008-12-14;2008-12-15;0;0;15;11;0;3;2;3;0;"Intempéries dans le Nord de l'Algérie et du Maroc : 11 morts";"""Le Nord de l'Algérie connaît des pluies diluviennes depuis plusieurs jours. Celkle-ci ont provoqué des inondations et des mouvements de terrain qui ont fait 7 morts et 15 blessés dans des effondrements et des accidents de la circulation.<br><br>Ainsi, à Chlef, 2 personnes sont mortes et 3 autres ont été blessées, dans l’effondrement d’un mur d’une habitation à Haï Chorfa, suite à un glissement de terrain. Dans la wilaya de Tébessa, les services de la protection civile ont assisté 3 personnes blessées suite à l’effondrement du toit de leur maison. En outre, les accidents de la circulation ont causé la mort de 5 personnes dont 4 suite à une collision entre une voiture et un camion à Tlemcen. La cinquième personne a perdu la vie après avoir été percutée par un véhicule à Tizi Ouzou.<br><br>A Tlemcen où les établissements scolaires ont fermé leurs portes après avoir libéré les élèves, les chasse-neige sont entrés en action pour dégager la chaussée. Des agents communaux procédaient, pour leur part, à l’enlevèrent des troncs d’arbres et autres branchages tombés sous le poids de la neige. Les équipes de la protection civile ont effectué plusieurs interventions suite à des inondations ou des effondrements.<br><br>Dans la wilaya de Naâma, 9 personnes ont été blessées dont une femme gravement, suite au dérapage d’un bus de transport de voyageurs sur la RN6. Cet accident survenu au lieu-dit « Aïn Mactaâ Edelli » est dû à l’état glissant de la chaussée, en raison des importantes chutes de neige. Les même services ont également fait sortir deux camions renversés sur le lit de Oued « El Harmel ».<br><br>Les agents de la Protection civile qui ont effectué 1.564 interventions dans des cas liés aux intempéries et aux accidents de la route, sont intervenus pour pomper les eaux qui ont inondé 25 maisons suite au débordement de Oued El-Fedha à Chlef. Les eaux ont également inondé plusieurs maisons à Boukadir. Des routes coupées, des effondrements, des inondations et des infiltrations d’eaux ont été signalés dans plusieurs régions de la wilaya de Chlef. Les fortes chutes de neige qui se poursuivent sur les régions nord du pays et les Hauts Plateaux ont causé la fermeture de nombreuses routes perturbant la circulation, selon la gendarmerie nationale.<br><br>A Tlemcen, une dizaine de routes se trouvent affectées par l’amoncellement de neige, qui a également perturbé la circulation routière dans plusieurs communes des wilayas de Tiaret et Tissemsilt. Il en est de même des wilayas de Médéa et Blida, où respectivement 2 et 3 routes sont coupées à la circulation, tandis que dans les wilayas de Tizi Ouzou et Bouira, les routes sont fermées au niveau des communes montagneuses, qui enregistrent traditionnellement en pareille saison d’importantes chutes de neige. Plusieurs routes sont impraticables dans les wilayas de Sidi Bel-Abbès, Saïda, El-Bayadh, Bordj Bou-Arréridj, Batna, Khenchela et Naâma. L’épaisseur de la neige a atteint les 30 cm dans certaines localités, provoquant de nombreux dérapages de véhicules et de camions.<br><br>A Tiaret, d’importantes chutes de neige ont été enregistrées durant la nuit de dimanche à lundi provoquant l’obstruction de la grande majorité des routes nationales et chemins de wilaya. Jusqu’à 10h, hier, la ville de Tiaret était toujours paralysée, la circulation automobile très difficile, les commerces fermés et des accidents nombreux à cause d’une chaussée impraticable. Même les entreprises et autres services publics sont restés fermés, la majorité des travailleurs n’ayant pas pu rejoindre leurs postes de travail à cause de l’absence quasi générale des moyens de transport. Des autocars assurant la desserte des wilayas de l’est et du sud du pays ont été bloqués par les importantes chutes de neige et plus de cent passagers ont été évacués dans des voitures légères et hébergés la nuit de dimanche à lundi dans des lycées et centres d’accueil à Tiaret. Selon les services météo de la station de Aïn Bouchekif, d’autres chutes de neige sont prévues pour la soirée de lundi à mardi.<br><br>A Mostaganem comme à Aïn Témouchent d’importante chutes de neige ont été enregistrées dimanche et lundi. Un fait rare et exceptionnel dans une ville côtière. Ces villes se sont réveillées avec un tapis de neige accompagné de grêle, ce qui a fait la grande joie des enfants, peu habitués à ce genre de paysage. Ces premières chutes de neige ont toutefois conduit, selon la gendarmerie nationale, à la coupure de la route nationale 101 reliant Berkèche à Sidi Bel-Abbès, ainsi que le chemin de wilaya 67 entre Aïn Témouchent et Terga où une déviation a été effectuée à El-Malah.<br><br><br>L'Est du Maroc a également été touché par ces intempéries. Une maison située dans le village de Oulad Ali Belhaj (province de Taza à 300 km à l'Est de Rabat) s'est effondrée sous l'effet des fortes pluies. 5 de ses occupants ont été tués."""
591;8770;Algérie;AG;Afrique;Maghreb;;;36.72;3.06;Hydro;Hydrologique;01;"01 Inondations et coulées de boue";011;"011 Crue";0112;"0112 Débordement torrentiel";2008;Nov.;2008-11-29;2008-11-30;0;0;0;0;0;0;1;1;0;"Inondations dans la région d'Alger";"""De fortes pluies ont été enregistrées dans la région d'Alger. Celles-ci ont provoqué des crues au niveau de l’oued Ouchayeh dans la circonscription de Hussein Dey.<br><br>Ces débordement ont causé des dégâts sur une dizaine d’habitations construites sur les rives de l’oued. Les autres, des baraques pour la majorité, ont été inondées par les eaux diluviennes et la boue. Des blocs de pierres arrachés ont été emportés avec des bruits assourdissants par la crue de l’oued. De vastes glissements de terrain étaient également perceptibles. Les eaux boueuses, noirâtres, ont transformé les lieux en paysage apocalyptique.<br><br>A signaler que plusieurs crues se sont produites notamment, ces dernières années. Pour la seule année 2008, pas moins de dix crues d’oueds sont enregistrées."""
155;8712;Algérie;AG;Afrique;Maghreb;;;36.72;3.32;Hydro;Hydrologique;01;"01 Inondations et coulées de boue";012;"012 Ruissellement";0122;"0122 Ruissellement urbain";2008;Nov.;2008-11-16;2008-11-16;0;0;0;1;0;2;2;2;0;"Fortes pluies et inondations dans le Nord de l'Algérie : 1 mort";"""De fortes pluies ont touché le Nord de l'Algérie dont la région de la Capitale Alger. Un homme est mort dans l'effondrement partiel de l'immeuble qu'il habitait à Bab El-Oued, quartier historique d'Alger, à la suite des pluies qui ont frappé la capitale algérienne ces derniers jours.Plusieurs autres régions du pays sont frappées par le mauvais temps, comme Tizi-Ouzou ou Jijel.<br><br>La ville de Bouira, ainsi que plusieurs communes ont été submergées par les eaux pluviales notamment en raison d'un réseau dévacuation pluvila déficient.<br><br>L'immeuble vétuste abritant seize familles s'est effondré du 5e au 2e &nbsp;étage, où habitait la victime. Selon les résidents l'immeuble menaçait de ruine et avait été classé d'abord en zone Rouge après les inondations survenues au quartier de &nbsp;Bab El-Oued en novembre 2001, puis en zone Orange après le séisme de mai &nbsp;2003"""
7064;8627;Algérie;AG;Afrique;Maghreb;;Maroc;35.07;-1.22;Hydro;Hydrologique;01;"01 Inondations et coulées de boue";011;"011 Crue";0112;"0112 Débordement torrentiel";2008;Oct.;2008-10-23;2008-10-25;0;0;10;19;0;3;3;3;0;" Inondations dans le Nord du Maroc et de l'Algérie: 19 morts";"""  24 et 25/10: De très fortes pluies se sont abattues sur les régions ouest de l'Algérie ont causé d'importantes inondations qui ont tué 2 personnes et fait dix blessés dans la commune de Bensekrane, relevant de la wilaya de Tlemcen.  Selon la chargée de la communication de la direction de la protection civile, ces fortes précipitations ont provoqué le débordement des eaux de l'Oued de «Tayarane» dans la localité d'El-Hamline où une maison a été submergée par les eaux qui ont atteint une hauteur de 40 cm.  Dix autres personnes ont été, également, blessées à la suite de ces crues qui ont emporté neuf véhicules. Face à l'ampleur des dégâts, de nombreux élèves n'ont pu rejoindre leurs bancs d'école et la circulation routière a été carrément bloquée.  De leur côté des équipes de la protection civile, appuyées par des citoyens sont parvenus à secourir plusieurs habitants dont les habitations ont été inondées par les eaux de pluie.   Le cadavre d'un jeune fellah qui a été emporté par la dernière crue, à Sebra, a été repêché à Hammam Boughrara. La victime âgée de 35 ans fut happée par les eaux en furie lorsqu'elle tentait de récupérer sa motopompe.Un berger âgé de 51 ans habitant à Mçalla (Ouzidane) avait été, lui aussi, surpris par l'oued Seffah, en crue.   Dans la wilaya d'El-Bayadh, des pluies diluviennes d'une intensité jamais enregistrée au cours des trois précédentes décennies se sont abattues sur cette région et plus précisément sur la daïra d'El-Abiod Sidi Cheikh qui a été sévèrement affectée par ces pluies.  Les grandes artères du chef-lieu de la wilaya ont été envahies par les eaux de pluie et la circulation automobile a été paralysée par des torrents d'eau et de boue, mettant ainsi à nu la défectuosité du réseau d'évacuation.   A El-Abiod Sidi Cheikh, chef-lieu de daïra situé dans l'extrême sud de la wilaya, plusieurs quartiers notamment ceux de Haï Gharbi et Chergui ont été inondés, ainsi que plusieurs structures socio-éducatives. Certains quartiers ont été cernés par les crues de l'oued. Une retenue d'eau a cédé à la pression de la furie des eaux. Vingt-six familles ont été sauvées à la hâte par les éléments de la protection civile assistés des éléments de la gendarmerie et de la police. Au moins de 500 habitations les pieds dans l'eau.   L’enclave de Melilla, une province espagnole située sur la côte Nord-Est du Maroc, a été touchée par de fortes précipitations qui ont provoqué des inondations. Le passage de la frontière avec le Maroc a été rendu impraticable, et la rivière Rio de Oro qui traverse la ville a débordé, provoquant l’inondation de plusieurs quartiers de la ville.  Les communications maritimes avec Malaga et Almeria ont été suspendues en raison de forts vents et d’une forte houle en me, il en a été de même pour les vols aérien.  En 12h00 les services météorologiques espagnols ont pu relever 110 mm de précipitations sur Melilla, dont 40 mm en l’espace d’une heure.23/10 : Des pluies torrentielles se sont abattues dans tout le nord du Maroc, faisant 11 morts.Selon le ministère de l'Intérieur, 11 personnes ont été tuées dans la région de Nador (nord-est), où des maisons se sont effondrées ou ont été submergées par les eaux. Deux personnes ont également été tuées à Tanger, dans le nord du pays, et quatre autres, dont un garçon de huit ans, à Oudja, près de la frontière algérienne.A Tanger, les inondations ont touchéplusieurs quartiers et d’une zone industrielle où des milliers d’ouvriers ont été bloquésPlusieurs artères au centre-ville et plusieurs quartiers ont été envahis par de fortes crues d'une hauteur dépassant un mètre dans certains endroits.Quant au dégâts matériels, la zone industrielle de M'ghougha, qui compte près de 140 usines, a été très affectée. La totalité de la zone industrielle a été submergée et que la hauteur de l'eau a dépassé 1,20 m.Depuis midi jusqu’à 18 heures (GMT), plus de 100 millimètres de pluie se sont abattues sur la ville, ce qui a amené les autorités locales à lancer un plan d’urgence pour secourir la population sinistrée.L’armée et la gendarmerie chérifienne prêtent main forte aux services du secours en vertu de ce plan activé en cas de « grand sinistre ».Des inondations ont également provoqué l'effondrement de plusieurs maisons dans le petit village de Driouch, près de Nador, dans le nord du pays. On déplore la mort de 11 personnes.Le Maroc a enregistré ses plus fortes précipitations de ces 35 dernières années pendant la période du 17 septembre au 23 octobre, selon les services de secours et de météorologie.Entre le 9 et 11 octobre, des pluies diluviennes ont fait 11 morts et causé l'effondrement de deux ponts et de 500 maisons en piséSource : MAPA"""
714;8576;Algérie;AG;Afrique;Maghreb;;;36.33;2.30;Hydro;Hydrologique;01;"01 Inondations et coulées de boue";011;"011 Crue";0112;"0112 Débordement torrentiel";2008;Oct.;2008-10-09;2008-10-10;0;0;8;6;0;3;2;3;0;"Nouvelles inondations torrentielles en Algérie : 6 morts";"""Six personnes ont trouvé la mort en Algérie et huit ont été blessées dans des inondations survenues à Aïn Torki, près d'Aïn Defla, à 120 km à l'ouest d'Alger.<br><br>Les victimes, âgées de 30 à 60 ans, ont été surprises dans leur sommeil par l'effondrement de leurs maisons après une crue subite de l'oued Djemai provoquée par des pluies abondantes dans la région de Aïn Torki.<br><br>Une cellule de crise a été constituée regroupant notamment les services des travaux publics, de l'hydraulique et de la santé tandis que les secours déblayaient dans la soirée les tonnes de boue charriées par les eaux.<br><br>Les services météorologiques avaient émis un bulletin spécial annonçant une activité pluvio-orageuse pour jeudi et vendredi dans au moins huit wilayas (départements) du pays dont celle d'Aïn Defla.<br><br>Des inondations ont fait 34 morts la semaine dernière à Ghardaïa, à 600 km au sud d'Alger, après des pluies torrentielles."""
4965;8544;Algérie;AG;Afrique;Maghreb;;;34.67;3.25;Hydro;Hydrologique;01;"01 Inondations et coulées de boue";011;"011 Crue";0112;"0112 Débordement torrentiel";2008;Sept.;2008-09-30;2008-10-01;0;59050;84;33;0;3;3;3;348;" Inondations dans le Nord de l'Algérie : 47 morts";"""01/10: Au moins 47 morts, 86 blessés, des centaines de maisons détruites, des routes coupées: la région de Ghardaia, à 600 km au sud d'Alger, a payé un lourd tribut aux pluies inhabituelles et diluviennes qui se sont abattues sur cette région semi-désertique.600 maisons au moins ont été atteintes par ces inondations, notamment dans les oasis. Plusieurs routes ont également été coupées et les liaisons téléphoniques très perturbées.Selon lui, les intempéries ont touché une région où il n'avait pas plu depuis quatre ans. Les cours d'eau du nord de la ville surtout, les oueds, ont débordé et se sont déversés dans l'oued M'zab qui a débordé, emportant tout sur son passage. Les autorités ont parlé d'un débit de 900 mètres cubes par seconde.Cela des témoins, il y avait jusqu'à huit mètres d'eau dans les ruelles étroites de la ville et les habitants de la palmeraie de Ghardaia ont dû se réfugier sur les terrasses des maisons ou sur les hauteurs.Sur place, les secours s'organisaient, des équipes médicales et de secours partaient des départements voisins, notamment de Naâma, Djelfa et Laghouat.Des groupes électrogènes, des moto-pompes, des engins de déblaiement étaient prévus ainsi que la fourniture de médicaments, nourriture, couvertures et eau potable.Ghardaia, porte du désert située dans la vallée du M'zab, site classé au patrimoine mondial, occupe une position centrale reliant les Hauts-Plateaux algériens avec le Sahara.Ces inondations ont occasionné des dégâts matériels estimés à près de 250 millions d'euros, dont 200 millions pour les infrastructures.En novembre 2001, des inondations avaient frappé Alger et sa région faisant plus de 800 morts et provoqué des dégâts considérables à Bab El Oued, vieux quartier historique de la capitale.En novembre 2001, des inondations avaient frappé Alger et sa région faisant plus de 800 morts et provoqué des dégâts considérables à Bab El Oued, vieux quartier historique de la capitale.30/09: Deux personnes dont un enfant de six ans sont mortes et six blessées dans des inondations consécutives à de fortes pluies tombées sur la région de Djelfa, à 300 km au sud d'Alger. Djelfa, comme de nombreuses autres villes du nord algérien, a enregistré de fortes pluies qui ont grossi les oueds au cours des deux derniers jours.  Un homme n'a pu sortir de son véhicule emporté par les flots de l'Oued El Baz, à une centaine de km de Djelfa tandis que le corps d'un enfant de six ans a été repêché après neuf heures de recherches dans les eaux d'un autre oued en crue. Les services de la protection civile locale ont pu sauver six personnes en difficulté qui ont été hospitalisées.  Les pluies diluviennes, qui ont duré trois heures sans arrêt, ont été suivies de grandes crues au niveau de certains quartiers de la ville, notamment Ras Louta et Homat El-Oued. Les commerces du marché central et de Kissariat Ben Omar ont été notamment affectés par les intempéries et un pont situé à Ras Louta et reliant plusieurs douars s’est effondré.Source : APS"""
