id;id_article;pays;fips;continent;sous_continent;localisation_fine;autres_pays_concernes;latitude;longitude;code_origine_alea;origine_alea;code_alea;alea;code_peril;peril;code_sous_peril;sous_peril;annee;mois;date_debut;date_fin;nbre_evacues;nbre_pers_affectees;nbre_blesses;nbre_victimes;nbre_sans_abris;indice_csq_humaines;indice_csq_materielles;indice_evt;cout_estime;titre_article;article
11454;18179;Algérie;AG;Afrique;Maghreb;;;35.93;1.56;Clim;Climatique;06;"06 Incendies de forêt";;;;;2014;Août;2014-08-11;2014-08-10;0;0;0;0;0;0;1;1;0;"3 incendies de forêt parcourt 33 ha dans le centre Nord de l'Algérie";"""Trois incendies de forêt dans la wilaya de Tissemsilt, ont ravagé plus de 33 ha de surfaces boisées.Ces foyers signalés dans des zones forestières denses ont détruit des superficies de pin d'Alep, de chêne, d'eucalyptus et de pin dans les forêts de Sidi Saïd (commune de Lazharia), d'ouled Meddah (El Malaâb) et Ledjmel à Sidi Boutechent.Les agents de la Protection civile, appuyés par des éléments de la conservation des forêts, ont maîtrisé, hier matin, la situation, après l'extinction de tous les incendies.L'intervention rapide des pompiers a pu sauver de grandes superficies de forêts et des habitations rurales, implantées à proximité des lieux des sinistres. Pour les besoins de ces interventions, 44 agents d'unités d'intervention de la Protection civile des daïras de la wilaya et 14 autres des services de la conservation des forêts ont été mobilisés. Sept camions citernes, quatre véhicules tout-terrain pour l'accès dans des endroits au relief accidenté ont été également utilisés.La forte canicule que connaît la région depuis la semaine dernière serait à l'origine de ces incendies. Un vent accompagné d'air chaud a permis la propagation des flammes.Source : L'Expression"""
11453;18178;Algérie;AG;Afrique;Maghreb;;;34.90;1.25;Clim;Climatique;06;"06 Incendies de forêt";;;;;2014;Août;2014-08-05;2014-08-05;0;0;0;0;0;0;1;1;0;"Un incendie de forêt parcourt 90 ha dans le Nord-ouest de l'Algérie";"""90 ha de forêt dont 40 hectares de pins d’Alep et 50 de maquis ont été brûlés dans le secteur de Sidi Mahdi en Algérie. Les flammes ont atteint les abords du mausolée de Syphax avant de s’en prendre au mont Skhouna. Le sinistren’a été maîtrisé que vers 23 h grâce au concours de la brigade mobile basée à Tlemcen.Notons enfin que la région de Béni-Saf est la plus boisée d’une wilaya où le couvert végétal atteint 12% alors que la norme est de 25%. C’est dire que l’incendie d’hier constitue une catastrophe écologique pour la région.Selon un bilan préliminaire établi dans ce contexte, les différents départs de feux, qui ont été générés, le plus souvent, par les fortes chaleurs caniculaires qui ont sévi dans la région, ont occasionné la destruction de plusieurs étendues forestières évaluées, en termes chiffrés, à plus de 1.700 hectares. Les superficies endommagées par les incendies qui ont été maîtrisés consécutivement aux multiples interventions conjuguées des agents forestiers et des sapeurs-pompiers de la Protection civile, sont constituées principalement de pins d’Alep, de broussailles et de maquis.Les espaces forestiers fortement touchés par les sinistres sont situés dans les massifs avoisinant les localités de Moulay Slissen, Zégla, Belarbi, Télagh et autres. Il est toutefois utile de signaler que le fameux plan de prévention et de lutte contre les incendies de forêts a été déclenché prématurément cette année à Sidi Bel Abbès, en raison d’une situation exceptionnelle générée précisément par plusieurs départs de feux qui se sont déclarés précocement dans divers sites forestiers de la wilaya.Source : El Watan"""
11421;18141;Algérie;AG;Afrique;Maghreb;;;36.93;3.18;Geo;Géologique;03;"03 Séismes";031;"031 Séismes tectoniques";;;2014;Août;2014-08-01;2014-08-01;0;0;420;6;0;3;0;3;0;"Séisme de magnitude 5.6 au large d'Alger : 6 morts et 420 blessés dans des mouvements de panique";"""Six personnes sont mortes et 420 ont été blessées dans la panique provoquée vendredi par un séisme de magnitude 5,6 sur l'échelle de Richter à Alger et dans les départements limitrophes.Quatre personnes sont mortes en se jetant depuis le balcon ou la fenêtre, deux autres ont subi un arrêt cardiaque. Tous les décès sont liés au mouvement de panique provoqué par le séisme: réveillés par la secousse, nombre d'habitants se sont précipités, voire jetés dans les rues, craignant des effondrements de bâtiments.Le séisme, survenu à 05H11, n'avait causé aucun dégât important. Son épicentre se situait en mer, à 19 km au nord-est de Bologhine (quartier d'Alger), selon le centre algérien de recherches en astronomie, astrophysique et géophysique (CRAAG).Ce dernier a déjà recensé 20 répliques, dont une de magnitude 4,3 un quart d'heure plus tard. «Ce séisme entre dans l'activité normale de la sismicité de l'Algérie qui se trouve au centre de deux plaques majeures.Localisation de l'événementSource : CRAAG"""
11416;18135;Algérie;AG;Afrique;Maghreb;;;36.55;6.13;Clim;Climatique;06;"06 Incendies de forêt";;;;;2014;Juill.;2014-07-29;2014-07-29;0;0;0;0;0;0;1;1;0;"Un incendie détruit 30 ha dans le Nord-Est de l'Algérie";"""Un feu de forêt a détruit 30 ha d'arbres de différentes espèces, dans la méchta El Bahloul', dans la commune Algérienne de Beïnen. En effet, l'ampleur du feu a mobilisé les unités de la Protection civile des communes de Ferdjioua et Oued Endja.Au bout de 4 longues heures d'efforts, les sapeurs-pompiers sont parvenus à empêcher les flammes d'atteindre une zone abritant des poulaillers ainsi que 20 habitations.Source : Le Quotidien d'Oran"""
11374;18082;Algérie;AG;Afrique;Maghreb;;;35.74;0.27;Clim;Climatique;06;"06 Incendies de forêt";;;;;2014;Juill.;2014-07-17;2014-07-18;0;0;0;0;0;0;1;1;0;"Incendies de forêt dans le Nord de l'Algérie";"""Des incendies de forêt se sont déclenché feux dans la forêt El-Ourit, située sur la route d'Aïn-Fezza, dans les abords de Tlemcen dans le Nord de l'Algérie.En effet, 15 foyers ont été signalés dans différentes régions de la wilaya à l'instar de Bouguirat, Khadra, Safsaf, Sidi Ali, Mazagran et Mostaganem où les dégâts sont évalués à plus de 30 hectares entre forêts, broussailles, maquis et arbres fruitiers.Source : Le Quotidien d'Oran"""
11247;17914;Algérie;AG;Afrique;Maghreb;;;36.38;3.89;Met;Météorologique;11;"11 Tornades et trombes";111;"111 Tornades";;;2014;Juin;2014-06-11;2014-06-11;0;0;0;0;0;0;2;2;0;"Tornade en Kabylie (Algérie)";"""Les habitants de la commune d'El Esnam peuplée d'environ 15.000 habitants et située à 10 kilomètres de Bouira, à l'est d'Alger, en Kabylie, ont été surpris par une impressionnante tornade qui s'est abattue sur le hameau de Kemkoum.Maisons soufflées, pylônes électriques arrachés, oliviers centenaires déracinés, abribus balayés, etc., la tornade était d'une telle force qu'elle a provoqué de nombreux dégâts dans la ville d'El Esnam, sans causer de victime, ni blessé.Même si elles restent rares, ce n'est pas la première fois que l'Algérie connaît des phénomènes de tornade.Source : La Liberté"""
11223;17881;Algérie;AG;Afrique;Maghreb;;;35.70;-0.65;Geo;Géologique;02;"02 Mouvements de terrain";021;"021 Glissement de terrain";;;2014;Juin;2014-06-08;2014-06-08;0;0;0;4;0;2;1;2;0;"Glissement de terrain à Oran (Algérie) : 4 morts";"""Quatre personnes d'une même famille ont trouvé la mort dans un glissement de terrain, survenu à proximité de la première voie d'évitement menant au port d'Oran en Algérie.Une habitation à hai 'Carteau' relevant du secteur urbain 'Seddikia' de la ville d'Oran s'est effondrée aux environs de 4 heures du matin suite à un affaissement de terrain, faisant deux morts sur place. Deux autres personnes ont succombé à leurs blessures après avoir été transportées vers les services d'urgences médicales.Les victimes de cet accident sont le père de famille, sa femme et leurs deux enfants. Un agent de la protection civile a été blessé suite à la chute d'une pierre lors de l'opération d'intervention.Source :Huffington Post"""
11200;17855;Algérie;AG;Afrique;Maghreb;;;36.75;3.04;Hydro;Hydrologique;01;"01 Inondations et coulées de boue";012;"012 Ruissellement";0122;"0122 Ruissellement urbain";2014;Juin;2014-06-02;2014-06-03;0;0;0;0;0;0;2;2;0;"Fortes pluies orageuses et inondations en Algérie";"""De fortes pluies orageuses se sont abattues sur le nord du pays ont causé des dommages matériels.À Alger, les trémies ont complètement été inondées dès 2h du matin à cause des fortes averses. Dans certaines localités de la capitale, comme à Dergana, Chéraga, Rouiba, Bab El-Oued et Draria. A Alger des embouteillages interminables se sont produits à cause des inondations de la chaussée, ailleurs, en revanche, les pluies ont causé de sérieux sinistres. Les policiers, chargés de la voie publique, ont eu du mal à réguler et à fluidifier la circulation automobile par endroits, surtout que le périphérique sud d’Alger et La Moutonnière ont été quasiment fermés par le flux important de véhicules bloqués par les eaux et le manque de visibilité.Le bilan des autorités fait état d’importants dégâts dans plusieurs wilayas. Dans la commune de Temzrit, à Béjaïa, les mêmes services ont constaté des inondations dues aux pluies à l’intérieur du CEM Idarakene, alors que deux autres collèges, en l’occurrence le CEM Ibn-Khaldoun (Aïn Ousséra) et le CEM Hirache-Abdelaziz (commune Charef), dans la wilaya de Djelfa, ont, eux aussi, subi d’énormes dégâts suite aux infiltrations des eaux.Selon la même source, les sapeurs-pompiers ont dû intervenir pour effectuer des opérations d’épuisement de ces eaux qui ont perturbé la scolarité des élèves.À Tizi Ouzou, plus exactement à Azeffoun, les eaux pluviales ont également fait des dégâts à l’intérieur du siège de la daïra, sachant que cette zone est très exposée aux vents forts qui ont soufflé sur le littoral.En outre, le centre-ville d’El-Kseur, à Béjaïa, et les trois cités El-Hadaïk, Ben-Tiba, Ben Souk El-Rahma, à Djelfa, ont été submergés par les pluies torrentielles qui ont duré toute la nuit et la matinée . En alerte maximale, les services de la Protection civile ont effectué plusieurs opérations pour venir en aide aux automobilistes en danger et ont assuré un service de proximité depuis l’annonce de ce BMS.Par ailleurs, et selon d’autres sources, le soulèvement du sable avec, en appoint, des vents qui soufflaient à 50 et 60 km/h a causé un ralentissement de l’activité de transport dans le Grand-Sud.Des convois bloqués par endroits ont été secourus par les services de sécurité qui ont déployé un dispositif spécifique afin de fluidifier la circulation ou encore assurer un service de proximité en nocturne en attendant une meilleure visibilité dans les wilayas du Sud algérien. Du reste, au moins 30 accidents de la circulation ont été enregistrés, à travers les wilayas du Nord, où la chaussée glissante a causé, par endroits, des carambolages.Source : Liberté Algérie"""
10926;17468;Algérie;AG;Afrique;Maghreb;;;36.50;2.80;Hydro;Hydrologique;01;"01 Inondations et coulées de boue";011;"011 Crue";0112;"0112 Débordement torrentiel";2014;Mars;2014-03-14;2014-03-15;100;0;0;7;0;3;2;3;0;"De fortes pluies causent des inondations dans le Nord de l'Algérie : 7 morts";"""Une dépression circule a circulé sur l'Algérie et la Tunisie. Elle a donné des pluies importantes sur le Maroc (notamment sur l’Atlas, où il a neigé à assez basse altitude) et l’ouest Algérien qui ont causé des inondations et ont fait 7 morts.De fortes chutes de pluies se sont abattues, ces dernières 24 heures, sur les différentes wilayas du Nord de l'Algérie et ont fait plusieurs victimes et des dégâts matériels.Durant les dernières 24 heures, les unités de la Protection civile ont enregistré quelque 2015 interventions, notamment en matière de dégâts et inondations causés par les intempéries qui se sont abattues à travers plusieurs régions du pays.Concernant les fortes chutes de pluie qui se sont abattues au niveau des wilayas du nord du pays, plusieurs opérations d'épuisement des eaux pluviales ont été effectuées par les unités de la Protection civile notamment à Alger, Béjaïa, Blida, Annaba, Oran, Tizi Ouzou, Batna, Khenchela et Constantine.70 personnes cernées par les eaux à l'intérieur de leurs habitations ont été sauvées et secourues au niveau de la wilaya de Khenchela. Huit effondrements partiels de murs et toitures d'habitations ont été enregistrés au niveau des wilayas d'Alger, Blida et Biskra .Dans la wilaya de Batna, 5 personnes sont décédées, asphyxiées par l'inhalation de monoxyde de carbone, suite à l'utilisation d'appareils de chauffage défectueux.Les victimes sont mortes dans deux accidents distincts survenus vendredi après-midi à Batna où de fortes précipitations et un froid très vif sont enregistrés depuis 48 heures.Le premier accident a provoqué la mort de quatre personnes appartenant à une même famille, âgées de 2 à 53 ans, à savoir, la mère, la grand-mère et deux enfants, découvertes sans vie en leur domicile à la cité Kechida au lieudit Boumlite.Le second sinistre a eu pour théâtre le quartier Parc à fourrages où un homme de 44 ans est décédé à l'intérieur d'une habitation au lieudit Lembarkia à Batna, selon le communiqué de la Protection civile.Les pluies diluviennes qui continuent de s'abattre dans cette wilaya ont fait déborder un oued sur la RN88, à hauteur de la localité d'Ouled Fadhel. Un cours d'eau dont les eaux en furie a entraîné un minibus, lui faisant quitter la route.L'intervention rapide des éléments des pompiers, qui étaient en alerte depuis la survenue de ces intempéries, a permis de secourir et de tirer d'affaire les occupants du véhicule de transport en commun parmi lesquels une femme, en état de choc, qui a dû être transportée au CHU de la ville.Les éléments de la Protection civile sont intervenus aussi pour pomper des eaux de pluie infiltrées dans nombre de maisons, notamment le long de la route de Tazoult, près du chef-lieu de wilaya, et secourir, en divers points de la wilaya, des automobilistes piégés sur les routes par ces fortes pluies.Dans la wilaya de Béjaïa, le conducteur d'un camion de transport de marchandises a été emporté hier matin par une crue de l'oued Soummam sur la RN12, reliant Béjaïa à Tizi Ouzou, à hauteur de la localité d'El Kseur. La victime, disparue, a été surprise par la crue alors qu'elle se trouvait à bord de son camion, a précisé la même source, qui n'exclut pas l'hypothèse que le conducteur, pris de panique, serait sorti de son camion avant d'être entraîné par le courant.D'importants moyens humains et matériels ont été engagés pour le retrouver, pas moins de 80 agents et 4 zodiacs ont été déployés, ajoute-t-on, soulignant cependant que l'opération est rendue difficile du fait des chutes ininterrompues de la pluie et de la force du courant.C'est quasiment tout l'oued Soummam qui a débordé depuis Béjaïa jusqu'à Tazmalt, sur une distance de plus de 80 km, provoquant des inondations dans une myriade de communes, notamment dans les grands centres urbains de Sidi Aïch, Ifri-Ouzellaguene, Tazmalt et Semaoun.A l'est, outre les villes côtières de Tichy, Aokas et Souk El Tenine, fortement submergées, un ouvrage en buses a cédé et a été emporté par les eaux à hauteur du village de Djebira (12 km de Béjaïa), enclavant irrémédiablement une centaine de familles riveraines.Quelque 40 mm de pluie ont été enregistrés dans la nuit de vendredi à samedi, à Béjaïa, selon la station météo de l'aéroport Abane Ramdane. Ces précipitations ne sont pas exceptionnelles. Elles ont généré beaucoup de dégâts, dont les plus visibles est la fermeture des routes, notamment au niveau des axes secondaires, des chemins de wilaya et communaux.   Le corps sans vie d'un enfant de 7 ans a été retiré, d'une fosse submergée par une brusque remontée des eaux causée par de fortes pluies, près de Chemora (Batna), tandis que de nombreuses habitations ont été inondées dans cette même wilaya ainsi qu'à Constantine.Les fortes averses qui se sont abattues pendant plus de deux jours sur la wilaya de Batna ont causé l'inondation de 19 maisons à travers plusieurs communes des Aurès, notamment celles de Tazoult, El Madher et Batna.Il s'agit pour la plupart de constructions vétustes où les sapeurs-pompiers sont intervenus jusqu'à une heure tardive de la nuit de vendredi à samedi pour pomper les eaux pluviales.Dans la wilaya de Constantine, plusieurs habitations ont été inondées ces dernières 24 heures à la suite de fortes précipitations.C'est surtout dans les communes de Zighoud Youcef et Didouche Mourad que les dégâts les plus importants ont été enregistrés, donnant lieu à de nombreuses interventions de secours.Les eaux se sont infiltrées dans 32 habitations situées dans les quartiers El Hamel Kef Salah et Kantrat Lahdid, dans la commune de Didouche Mourad, à la cité Zouabar Abdallah et au village Mihoubi Mohamed-Salah, à Zighoud Youcef.Ces fortes chutes de pluie ont inondé une minoterie située dans la zone industrielle de Didouche Mourad. Plusieurs artères de la ville de Constantine, sont difficilement praticables à cause de l'obstruction des avaloirs et des réseaux d'évacuation des eaux usées.Six maisons sont sérieusement menacées par un important glissement de terrain au village Taddart, dans la commune d’Azazga.Les services municipaux, en collaboration avec la Protection civile, ont procédé à l’évacuation des familles. Les fortes pluies qui se sont abattues sur la région, jeudi et vendredi passés, ayant atteint 53 mm durant ces deux jours, ont provoqué un impressionnant glissement de terrain, dont la surface affaissée est évalué à 2000m2, dans le village Taddart, à l’ouest de la ville d’Azazga. Survenu sous l’effet des fortes précipitions, un talus de terre a donc cédé sous cette forte pression, mettant en danger six familles résidant en ce lieu réputé pour ses hauts risques de glissements de terrain.Source : AP, Le Matin"""
10885;17409;Algérie;AG;Afrique;Maghreb;;;36.77;5.95;Hydro;Hydrologique;01;"01 Inondations et coulées de boue";011;"011 Crue";0112;"0112 Débordement torrentiel";2014;Mars;2014-03-03;2014-03-03;0;0;2;0;0;1;1;1;0;"De fortes pluies causent des inondations d'oued dans le Nord de l'Algérie";"""Les fortes précipitations enregistrées durant les dernières vingt-quatre heures ont été à l’origine de l’inondation dans la région de Jijel dans le Nord de l'Algérie. Les fortes pluies ont provoqué le débordement de plusieurs cours d'eau.La route qui relie Chekfa à la RN43 au niveau d’El Kennar a été inondée sur plus d’une centaine de mètres. Cinq foyers se trouvant dans la localité d’Ersaâ ont été surpris par la montée des eaux dans leurs habitations. Deux enfants, victimes apparemment d’hypothermie, ont été évacués à l’hôpital Saïd Medjdoub de Taher.Source : El Watan"""
10407;16742;Algérie;AG;Afrique;Maghreb;;;34.56;3.51;Hydro;Hydrologique;01;"01 Inondations et coulées de boue";011;"011 Crue";0112;"0112 Débordement torrentiel";2013;Oct.;2013-10-07;2013-10-09;80;0;0;9;0;3;2;3;0;"Crues torrentielles dans le centre Nord de l'Algérie : 9 morts";"""08 et 09/10 : De fortes pluies ont durement frappé les secteurs de Djelfa et Sétif, faisant 9 morts au total, alors qu’à M’sila, des dizaines de familles ont dû quitter leur maison et se réfugier dans une école.Cinq corps sans vie ont été repêchés hier, à Djelfa, après de violentes intempéries ayant frappé la ville et ses alentours dans la nuit de mardi provoquant, notamment, un débordement de deux oueds.La cinquième victime, un homme de 47 ans, porté disparu, a été retrouvée par la Protection civile. Le corps a été transféré vers la morgue de l’hôpital du chef-lieu de wilaya. Le corps de la victime a été repêché par les pompiers dans la localité de Dhayet El-Gort-Brouth, après une opération de recherche entamée juste après le repêchage et le transfert à l’hôpital de cinq autres personnes emportées par les crues des oueds Ettarous et El-Fercha, dans la commune d’El-Keddid. Cette dernière victime retrouvée était à bord de l’un des deux véhicules touristiques emportés, dans la nuit, par les crues des oueds, suite aux pluies torrentielles qui se sont abattues sur la région.Dans la wilaya de Sétif, deux personnes âgées d’une quarantaine d’années ont trouvé la mort.Les victimes ont été emportées par les eaux en crue de oued Barhoum, à Ouled Tebbène, au sud de la wilaya de Sétif. Les pluies diluviennes qui se sont abattues sur la wilaya de Sétif, ont causé d’importants dégâts matériels. Au chef-lieu de wilaya, en moins d’une heure trente, les éléments de la Protection civile ont dû intervenir plusieurs fois.07/10 : De fortes averses orageuses affectent la wilaya algérienne de Khenchela et sont à l'origine de la mort de 2 enfants et causé des inondations localisées. Les crues ont également ravagé de vastes superficies de vergers et de champs maraîchers, causant également d’importants dégâts dans plusieurs zones rurales de la wilaya.Deux enfants ont trouvé la mort par noyade, dans une mare à la cité 8 mai 1945, dans la commune d’Ouled Rechache, à Khenchela. Les victimes âgées d’une douzaine d’années, couraient pour s’abriter des pluies torrentielles qui se sont abattues sur la région, lorsqu’elles sont tombées dans une énorme flaque d’eau formée dans une excavation creusée dans un chantier.Les fortes chutes de pluies qui se sont abattues sur cette wilaya ont paralysé, par endroits, la circulation routière, rendant impraticables plusieurs axes, notamment la route nationale (RN) n°88 reliant Khenchela à Batna.Source : Liberté Algérie"""
10335;16586;Algérie;AG;Afrique;Maghreb;;;36.17;6.72;Hydro;Hydrologique;01;"01 Inondations et coulées de boue";011;"011 Crue";0112;"0112 Débordement torrentiel";2013;Sept.;2013-09-10;2013-09-10;0;0;0;0;0;0;1;1;0;"Crue torrentielles localisées dans le Nord de l'Algérie";"""De fortes pluies orageuses causé des inondations torrentielles dans le secteur de El Gourzi, dans la commune de Ouled Rahmoune. Les précipitations diluviennes, ont eu pour effet, une montée des eaux de l'oued qui traverse la région, lesquelles crues conjuguées à la vétusté du réseau d'assainissement ont causé beaucoup de dégâts, empêchant aussi les nombreux enfants de rejoindre leurs établissements scolaires et provoquant l'isolement de localités limitrophes, situées dans la commune voisine d'Ibn Ziad, à l'instar de celle de Khelfaoui.Source : Oran News"""
10316;16554;Algérie;AG;Afrique;Maghreb;;Tunisie;35.91;2.78;Hydro;Hydrologique;01;"01 Inondations et coulées de boue";011;"011 Crue";0112;"0112 Débordement torrentiel";2013;Sept.;2013-09-05;2013-09-04;1000;0;0;7;0;3;2;3;0;"Des orages causent des inondations torrentielles en Algérie et en Tunisie : 7 morts";"""Déjà touchées par de forts oragesle week-end dernier, l'Algérie et la Tunisie ont de nouveau connu de violents orages qui ont causé des inondations torrentielles qui ont fait des dommages matériels et 7 victimes.En Tunisie, les fortes chutes de pluies qui se sont abattues ces dernières heures sur la plupart des régions, les unités de la protection civile ont multiplié les interventions dans plusieurs régions du pays comme Kébili, Bizerte et Mahdia, à la suite des inondations qui en ont résulté.La ville de Kébili située dans le Sud du pays a été particulièrement touchée, les pluies torrentielles ayant détruit de nombreux hectares de cultures de dattes, principale source de revenus des 20 000 habitants de la ville.De nombreuses maisons ont été inondées et les bénévoles de la protection civile ont effectué des centaines d'opérations de sauvetage. Une autre ville a été durement touchée par les pluies , Sers dans le nord du pays. Plus de 500 familles ont été évacuées dans le district voisin de El Marja, où de nombreuses rivières ont débordé.En Algérie, les autorités déplorent sept victimes en raison des mauvaises conditions météorologiques. Deux décès ont été signalés dans la ville de Sebt Ali, au sud de la capitale de la province de Médéa. En outre, 20 maisons ont été endommagées à Sedraya Wilaya.Source : El Watan, AP"""
